{
    "schema_version":  1,
    "current_phase":  "MT5_AI_SCALPING_BOT",
    "live_execution_authorized":  false,
    "decisions":  [
                      {
                          "id":  "PHASE_21_CLOSED",
                          "status":  "CLOSED_FOR_THIS_HYPOTHESIS",
                          "reference":  "docs/PHASE_21_FAILURE_POSTMORTEM.md"
                      },
                      {
                          "id":  "JFOREX_PATH",
                          "status":  "ABANDONED_FOR_OPERATIONAL_COMPLEXITY",
                          "reference":  "docs/PHASE_22_DATA_SOURCE_DECISION.md"
                      },
                      {
                          "id":  "PHASE_22_DATASET",
                          "status":  "PHASE_22_DATA_READY",
                          "provider":  "ROBOFOREX_MT5",
                          "normalized_root_sha256":  "ae0f5b70f686c1b0fff05c0b71f9efb7c3d5da4983eba0df895989dbf6572a91",
                          "reference":  "docs/PHASE_22_MT5_DATASET_COMPLETION.md"
                      },
                      {
                          "id":  "PHASE_22A_COMPLETION",
                          "status":  "PHASE_22A_ROBUST_PHENOMENON_FOUND",
                          "run_id":  "phase22a_20260909T220000Z",
                          "commit":  "4ae2e3329e23574d66d89278931aeaa6756c7149",
                          "specification_sha256":  "11581b33dcd0616d25ad39cc2de37db6e4bbba62e49ea1d283b1a3449d988323",
                          "dataset_root_sha256":  "ae0f5b70f686c1b0fff05c0b71f9efb7c3d5da4983eba0df895989dbf6572a91",
                          "final_report_sha256":  "05910f453b7ccff64748fe90ff35b3195ccb1c5fa5653f21cd954a8a4112ee4a",
                          "discovery_survivors":  55,
                          "confirmation_survivors":  36,
                          "holdout_survivors":  26,
                          "concentration_qualified":  22,
                          "leading_phenomenon":  "P22A_SPR_ABS_15s_60s",
                          "accessed_through_year":  2023,
                          "accessed_2024_plus":  false,
                          "reference":  "reports/phase22a/phase22a_20260909T220000Z/final_report.json"
                      },
                      {
                          "reference":  "docs/PROJECT_MISSION_AND_ROADMAP.md",
                          "status":  "ACTIVE",
                          "id":  "MASTER_PROJECT_MISSION"
                      },
                      {
                          "specification_sha256":  "343b6918acb62a68065eb16ecfc7fd05704fe8a77695d8417f7f81062475d56d",
                          "status":  "APPROVED",
                          "id":  "PHASE_22B_V6_REVIEW",
                          "reference":  "governance/results/PH22B-REVIEW-009.json"
                      },
                      {
                          "id":  "PHASE_22B_DEVELOPMENT_ACCESS",
                          "approval_sha256":  "2649058a3326c37cdb6c4d0dc0946f70fadc3ae7b1d6c35a0022fcade950f41b",
                          "forbidden":  "2024+",
                          "years":  [
                                        2019,
                                        2020,
                                        2021
                                    ],
                          "locked":  [
                                         2022,
                                         2023
                                     ],
                          "status":  "AUTHORIZED",
                          "symbols":  [
                                          "EURUSD",
                                          "GBPUSD",
                                          "USDJPY",
                                          "USDCAD"
                                      ],
                          "reference":  "governance/approvals/PH22B-DEV-2019-2021-AUTH-001.json"
                      },
                      {
                          "id":  "PHASE_22B_IMPLEMENTATION_ATTEMPT_001",
                          "status":  "PHASE_22B_INVALID_RESEARCH_RUN",
                          "task_id":  "PH22B-RI-001",
                          "incident_sha256":  "e6c56489cdfdc90e97675ce9c0a34944e93b32554323f267e37b2d88bf4dff8c",
                          "market_content_opened":  false,
                          "locked_metadata_exposed":  "at least 2022 filenames",
                          "next_gate":  "HUMAN_GATE_REQUIRED",
                          "reference":  "governance/incidents/PH22B-RI-001-LOCKED-DATA-ENUMERATION.json"
                      },
                      {
                          "id":  "PHASE_22B_IMPLEMENTATION_ATTEMPT_002",
                          "status":  "AUTHORIZED_FRESH_ISOLATED_TASK",
                          "task_id":  "PH22B-RI-002",
                          "human_approval_sha256":  "d945e57498d6a79f3a550ed2ce61868f2f69aa0653854ca41602ed0ee1a2cc6c",
                          "data_authority":  "unchanged 2019-2021 four pairs",
                          "locked":  [
                                         2022,
                                         2023
                                     ],
                          "forbidden":  "2024+",
                          "reference":  "governance/tasks/PH22B-RI-002.json"
                      },
                      {
                          "id":  "PHASE_22B_V7_DETERMINISM_AUTHORIZATION",
                          "status":  "AUTHORIZED",
                          "approval_sha256":  "f32b61d98c287b475a3398933af85f890af3652e2247d76ce33d3e603a53b452",
                          "scope":  "implementation-semantic clarification only",
                          "standing_autonomy":  true,
                          "locked":  [
                                         2022,
                                         2023
                                     ],
                          "forbidden":  "2024+",
                          "reference":  "governance/approvals/PH22B-V7-DETERMINISM-AUTH-001.json"
                      },
                      {
                          "id":  "PHASE_22B_V7_FREEZE",
                          "status":  "APPROVED",
                          "specification_sha256":  "fc70cd7a195b5fd9fd72256e1721eb46f6dc90567df4012c8af90d35f0e4499d",
                          "commit":  "9a0287f76422fc2954f0441b3e59394a4007557b",
                          "statistical_review_sha256":  "0abab008d273952004f99a0f150852166f272fa7ac1620754410230f830f7c27",
                          "qa_review_sha256":  "38f2e1d8cfc299a6506f2dfb2ee9a61b16987889429cbe01b5a9ebcbc66ff15c",
                          "v6_preserved":  true,
                          "protected_authority_unchanged":  true,
                          "next_task":  "PH22B-RI-002",
                          "reference":  "governance/results/PH22B-RL-010.json"
                      },
                      {
                          "id":  "PHASE_22B_V12_FREEZE_BINDING",
                          "status":  "APPROVED_FOR_IMPLEMENTATION_REVIEW",
                          "specification_path":  "research/phase22b_spec_v12.json",
                          "specification_sha256":  "12eb328ccc433a4dd75128fafdfb56fe293e30c96bc0962510554b218621610f",
                          "statistical_review_sha256":  "e50224aff5acefefa4752d5023970c464536b8e620023b483eabc2b0e73d005f",
                          "qa_review_sha256":  "a828b735e564fa0afbefec67e208fefe5858db08e5c22c1cb0259c6d1386a0a1",
                          "active_task":  "PH22B-RI-002",
                          "allowed_years":  [
                                                2019,
                                                2020,
                                                2021
                                            ],
                          "locked_years":  [
                                               2022,
                                               2023
                                           ],
                          "forbidden":  "2024+",
                          "strategy_authorized":  false,
                          "pnl_authorized":  false,
                          "execution_authorized":  false,
                          "live_authorized":  false,
                          "phase_advanced":  false,
                          "data_authority_changed":  false,
                          "reference":  "governance/tasks/PH22B-RI-002.json"
                      },
                      {
                          "id":  "PHASE_22B_V12_IMPLEMENTATION_READINESS",
                          "status":  "AUTHORIZED_2019_2021_DEVELOPMENT_EXECUTION",
                          "reviewed_implementation_commit":  "e548dd244812a689b49666e98e56e2b27facddd7",
                          "specification_path":  "research/phase22b_spec_v12.json",
                          "specification_sha256":  "12eb328ccc433a4dd75128fafdfb56fe293e30c96bc0962510554b218621610f",
                          "statistical_review_sha256":  "014098ccd3b158e6e3047914c8e8828cfba9eaafaaba380792e088d4ae37004b",
                          "statistical_result_sha256":  "8b9e9ab1e69011d5c87558a08779ef34adf7624a84bb9cddf6b208862ba4b416",
                          "qa_review_sha256":  "441bfda1e0889baf5990176b3421240496cfd7ed926230893cfbee0f385fcd6e",
                          "qa_result_sha256":  "01d79f0dd43b8461ae04243d34c4112e2305dd9d2889b0c616324989c0a8822a",
                          "active_task":  "PH22B-RI-002",
                          "allowed_years":  [
                                                2019,
                                                2020,
                                                2021
                                            ],
                          "locked_years":  [
                                               2022,
                                               2023